{
  "components": [
    {
      "attrs": {
        "l1_role": "supply",
        "voltage": 3.3
      },
      "authored": true,
      "kind": "source",
      "logic_fn": null,
      "refdes": "PS1",
      "terminals": [
        {
          "function": "",
          "iface": null,
          "iface_member": null,
          "name": "VOUT",
          "prov_v": 3.3,
          "req_v": null,
          "role": "power_out"
        },
        {
          "function": "",
          "iface": null,
          "iface_member": null,
          "name": "GND",
          "prov_v": null,
          "req_v": null,
          "role": "ground"
        }
      ],
      "value": "SRC-3.3V"
    },
    {
      "attrs": {
        "l1_role": "mcu"
      },
      "authored": true,
      "kind": "mcu",
      "logic_fn": null,
      "refdes": "U1",
      "terminals": [
        {
          "function": "",
          "iface": null,
          "iface_member": null,
          "name": "VDD",
          "prov_v": null,
          "req_v": 3.3,
          "role": "power_in"
        },
        {
          "function": "",
          "iface": null,
          "iface_member": null,
          "name": "GND",
          "prov_v": null,
          "req_v": null,
          "role": "ground"
        },
        {
          "function": "",
          "iface": "oscillator",
          "iface_member": "require",
          "name": "OSC1",
          "prov_v": null,
          "req_v": null,
          "role": "passive"
        },
        {
          "function": "",
          "iface": "oscillator",
          "iface_member": "require",
          "name": "OSC2",
          "prov_v": null,
          "req_v": null,
          "role": "passive"
        }
      ],
      "value": "MCU-XTAL"
    },
    {
      "attrs": {
        "cl_pf": 12.5,
        "cstray_pf": 2.5,
        "l1_role": "xtal"
      },
      "authored": true,
      "kind": "crystal",
      "logic_fn": null,
      "refdes": "Y1",
      "terminals": [
        {
          "function": "",
          "iface": "oscillator",
          "iface_member": "provide",
          "name": "X1",
          "prov_v": null,
          "req_v": null,
          "role": "passive"
        },
        {
          "function": "",
          "iface": "oscillator",
          "iface_member": "provide",
          "name": "X2",
          "prov_v": null,
          "req_v": null,
          "role": "passive"
        }
      ],
      "value": "XTAL-8MHz"
    },
    {
      "attrs": {
        "derived": "decoupling for mcu.pwr",
        "for_demand": "mcu.pwr"
      },
      "authored": false,
      "kind": "capacitor",
      "logic_fn": null,
      "refdes": "C1",
      "terminals": [
        {
          "function": "",
          "iface": null,
          "iface_member": null,
          "name": "1",
          "prov_v": null,
          "req_v": null,
          "role": "passive"
        },
        {
          "function": "",
          "iface": null,
          "iface_member": null,
          "name": "2",
          "prov_v": null,
          "req_v": null,
          "role": "passive"
        }
      ],
      "value": "100nF"
    },
    {
      "attrs": {
        "derived": "load cap 0 for xtal: 2*(CL-Cstray) = 2*(12.5-2.5) = 20pF",
        "for_demand": "xtal"
      },
      "authored": false,
      "kind": "capacitor",
      "logic_fn": null,
      "refdes": "C2",
      "terminals": [
        {
          "function": "",
          "iface": null,
          "iface_member": null,
          "name": "1",
          "prov_v": null,
          "req_v": null,
          "role": "passive"
        },
        {
          "function": "",
          "iface": null,
          "iface_member": null,
          "name": "2",
          "prov_v": null,
          "req_v": null,
          "role": "passive"
        }
      ],
      "value": "20pF"
    },
    {
      "attrs": {
        "derived": "load cap 1 for xtal: 2*(CL-Cstray) = 2*(12.5-2.5) = 20pF",
        "for_demand": "xtal"
      },
      "authored": false,
      "kind": "capacitor",
      "logic_fn": null,
      "refdes": "C3",
      "terminals": [
        {
          "function": "",
          "iface": null,
          "iface_member": null,
          "name": "1",
          "prov_v": null,
          "req_v": null,
          "role": "passive"
        },
        {
          "function": "",
          "iface": null,
          "iface_member": null,
          "name": "2",
          "prov_v": null,
          "req_v": null,
          "role": "passive"
        }
      ],
      "value": "20pF"
    }
  ],
  "escalations": [],
  "invariants": [],
  "nets": [
    {
      "ground_kind": "ground",
      "ground_role": "none",
      "kind": "ground",
      "name": "GND",
      "nodes": [
        [
          "PS1",
          "GND"
        ],
        [
          "U1",
          "GND"
        ],
        [
          "C1",
          "2"
        ],
        [
          "C2",
          "2"
        ],
        [
          "C3",
          "2"
        ]
      ],
      "voltage": 0.0
    },
    {
      "kind": "power",
      "name": "+3V3",
      "nodes": [
        [
          "PS1",
          "VOUT"
        ],
        [
          "U1",
          "VDD"
        ],
        [
          "C1",
          "1"
        ]
      ],
      "voltage": 3.3
    },
    {
      "kind": "signal",
      "name": "mcu.osc.p1",
      "nodes": [
        [
          "Y1",
          "X1"
        ],
        [
          "U1",
          "OSC1"
        ],
        [
          "C2",
          "1"
        ]
      ],
      "voltage": null
    },
    {
      "kind": "signal",
      "name": "mcu.osc.p2",
      "nodes": [
        [
          "Y1",
          "X2"
        ],
        [
          "U1",
          "OSC2"
        ],
        [
          "C3",
          "1"
        ]
      ],
      "voltage": null
    }
  ]
}
